19:25:36.987869 ARP, Request who-has 192.168.42.129 tell 169.254.22.1, length 28
19:25:38.011147 ARP, Request who-has 192.168.42.129 tell 169.254.22.1, length 28
19:25:39.024480 ARP, Request who-has 192.168.42.129 tell 169.254.22.1, length 28
19:25:39.374544 IP 0.0.0.0.bootpc > 255.255.255.255.bootps: BOOTP/DHCP, Request from 3c:97:0e:d8:80:6c (oui Unknown), length 350
19:25:40.515303 LLDP, length 104: (none).(none)
19:25:42.697775 ARP, Request who-has 192.168.42.129 tell 169.254.22.1, length 28
19:25:43.717815 ARP, Request who-has 192.168.42.129 tell 169.254.22.1, length 28
19:25:44.731146 ARP, Request who-has 192.168.42.129 tell 169.254.22.1, length 28
19:25:47.704625 ARP, Request who-has 192.168.42.129 tell 169.254.22.1, length 28
19:25:57.717988 ARP, Request who-has 192.168.42.129 tell 169.254.22.1, length 28
19:25:58.731147 ARP, Request who-has 192.168.42.129 tell 169.254.22.1, length 28
19:25:59.744478 ARP, Request who-has 192.168.42.129 tell 169.254.22.1, length 28
19:26:42.515671 LLDP, length 104: (none).(none)
19:26:44.394536 IP 0.0.0.0.bootpc > 255.255.255.255.bootps: BOOTP/DHCP, Request from 3c:97:0e:d8:80:6c (oui Unknown), length 350
19:27:13.514659 LLDP, length 104: (none).(none)
19:27:42.166426 IP 192.168.1.10.nfs > 239.255.255.250.1900: UDP, length 309
19:27:42.274687 IP 192.168.1.10.nfs > 239.255.255.250.1900: UDP, length 309
19:27:42.384692 IP 192.168.1.10.nfs > 239.255.255.250.1900: UDP, length 309
19:27:42.494686 IP 192.168.1.10.nfs > 239.255.255.250.1900: UDP, length 309
19:27:42.604706 IP 192.168.1.10.nfs > 239.255.255.250.1900: UDP, length 359
19:27:42.714703 IP 192.168.1.10.nfs > 239.255.255.250.1900: UDP, length 359
19:27:43.104610 ARP, Request who-has 192.168.42.129 tell 169.254.22.1, length 28
19:27:44.117803 ARP, Request who-has 192.168.42.129 tell 169.254.22.1, length 28
19:27:44.516087 LLDP, length 104: (none).(none)
19:27:45.131137 ARP, Request who-has 192.168.42.129 tell 169.254.22.1, length 28
19:27:48.111177 ARP, Request who-has 192.168.42.129 tell 169.254.22.1, length 28
19:27:49.077880 IP 0.0.0.0.bootpc > 255.255.255.255.bootps: BOOTP/DHCP, Request from 3c:97:0e:d8:80:6c (oui Unknown), length 350
19:27:49.131136 ARP, Request who-has 192.168.42.129 tell 169.254.22.1, length 28
19:27:50.144467 ARP, Request who-has 192.168.42.129 tell 169.254.22.1, length 28
19:27:53.117924 ARP, Request who-has 192.168.42.129 tell 169.254.22.1, length 28
19:28:15.515004 LLDP, length 104: (none).(none)
19:28:46.516476 LLDP, length 104: (none).(none)
19:28:53.145034 ARP, Reply 192.168.1.10 is-at 00:25:90:6f:c5:a8 (oui Unknown), length 46
19:28:53.187859 IP 0.0.0.0.bootpc > 255.255.255.255.bootps: BOOTP/DHCP, Request from 3c:97:0e:d8:80:6c (oui Unknown), length 350
19:29:19.137935 LLDP, length 104: (none).(none)
19:29:50.137901 LLDP, length 104: (none).(none)
19:29:57.317859 IP 0.0.0.0.bootpc > 255.255.255.255.bootps: BOOTP/DHCP, Request from 3c:97:0e:d8:80:6c (oui Unknown), length 350
19:30:02.004507 ARP, Request who-has 192.168.42.129 tell 169.254.22.1, length 28
19:30:03.024454 ARP, Request who-has 192.168.42.129 tell 169.254.22.1, length 28
19:30:04.037786 ARP, Request who-has 192.168.42.129 tell 169.254.22.1, length 28
19:30:07.011172 ARP, Request who-has 192.168.42.129 tell 169.254.22.1, length 28
19:30:08.037786 ARP, Request who-has 192.168.42.129 tell 169.254.22.1, length 28
19:30:09.051127 ARP, Request who-has 192.168.42.129 tell 169.254.22.1, length 28
19:30:12.017927 ARP, Request who-has 192.168.42.129 tell 169.254.22.1, length 28
19:30:13.024450 ARP, Request who-has 192.168.42.129 tell 169.254.22.1, length 28
19:30:14.037785 ARP, Request who-has 192.168.42.129 tell 169.254.22.1, length 28
19:30:17.024506 ARP, Request who-has 192.168.42.129 tell 169.254.22.1, length 28
19:30:18.037785 ARP, Request who-has 192.168.42.129 tell 169.254.22.1, length 28
19:30:19.051121 ARP, Request who-has 192.168.42.129 tell 169.254.22.1, length 28
19:30:21.138289 LLDP, length 104: (none).(none)
19:30:22.285571 ARP, Request who-has 192.168.42.129 tell 169.254.22.1, length 28
19:30:23.291118 ARP, Request who-has 192.168.42.129 tell 169.254.22.1, length 28
19:30:24.304452 ARP, Request who-has 192.168.42.129 tell 169.254.22.1, length 28
19:30:27.291168 ARP, Request who-has 192.168.42.129 tell 169.254.22.1, length 28
19:30:28.304450 ARP, Request who-has 192.168.42.129 tell 169.254.22.1, length 28
19:30:29.317784 ARP, Request who-has 192.168.42.129 tell 169.254.22.1, length 28
19:30:32.297923 ARP, Request who-has 192.168.42.129 tell 169.254.22.1, length 28
19:30:33.317785 ARP, Request who-has 192.168.42.129 tell 169.254.22.1, length 28
19:30:34.331119 ARP, Request who-has 192.168.42.129 tell 169.254.22.1, length 28
19:30:37.304499 ARP, Request who-has 192.168.42.129 tell 169.254.22.1, length 28
19:30:38.331118 ARP, Request who-has 192.168.42.129 tell 169.254.22.1, length 28
19:30:39.344451 ARP, Request who-has 192.168.42.129 tell 169.254.22.1, length 28
19:30:52.138282 LLDP, length 104: (none).(none)
19:31:00.544513 IP 0.0.0.0.bootpc > 255.255.255.255.bootps: BOOTP/DHCP, Request from 3c:97:0e:d8:80:6c (oui Unknown), length 350
19:31:23.138705 LLDP, length 104: (none).(none)
19:31:54.138677 LLDP, length 104: (none).(none)
19:32:05.207836 IP 0.0.0.0.bootpc > 255.255.255.255.bootps: BOOTP/DHCP, Request from 3c:97:0e:d8:80:6c (oui Unknown), length 350
19:32:25.139113 LLDP, length 104: (none).(none)
19:32:56.139049 LLDP, length 104: (none).(none)
19:33:08.707838 IP 0.0.0.0.bootpc > 255.255.255.255.bootps: BOOTP/DHCP, Request from 3c:97:0e:d8:80:6c (oui Unknown), length 350
19:33:27.139458 LLDP, length 104: (none).(none)
19:33:58.139465 LLDP, length 104: (none).(none)
19:34:11.781166 IP 0.0.0.0.bootpc > 255.255.255.255.bootps: BOOTP/DHCP, Request from 3c:97:0e:d8:80:6c (oui Unknown), length 350
19:34:29.139847 LLDP, length 104: (none).(none)
19:35:00.139798 LLDP, length 104: (none).(none)
19:35:01.320894 ARP, Request who-has 192.168.42.129 tell 169.254.22.1, length 28
19:35:02.331092 ARP, Request who-has 192.168.42.129 tell 169.254.22.1, length 28
19:35:03.344422 ARP, Request who-has 192.168.42.129 tell 169.254.22.1, length 28
19:35:06.327817 ARP, Request who-has 192.168.42.129 tell 169.254.22.1, length 28
19:35:07.344424 ARP, Request who-has 192.168.42.129 tell 169.254.22.1, length 28
19:35:08.357757 ARP, Request who-has 192.168.42.129 tell 169.254.22.1, length 28
19:35:11.334566 ARP, Request who-has 192.168.42.129 tell 169.254.22.1, length 28
19:35:12.357758 ARP, Request who-has 192.168.42.129 tell 169.254.22.1, length 28
19:35:13.371089 ARP, Request who-has 192.168.42.129 tell 169.254.22.1, length 28
19:35:16.341144 ARP, Request who-has 192.168.42.129 tell 169.254.22.1, length 28
19:35:16.491161 IP 0.0.0.0.bootpc > 255.255.255.255.bootps: BOOTP/DHCP, Request from 3c:97:0e:d8:80:6c (oui Unknown), length 350
19:35:17.344423 ARP, Request who-has 192.168.42.129 tell 169.254.22.1, length 28
19:35:18.357759 ARP, Request who-has 192.168.42.129 tell 169.254.22.1, length 28
19:35:21.598534 ARP, Request who-has 192.168.42.129 tell 169.254.22.1, length 28
19:35:22.624421 ARP, Request who-has 192.168.42.129 tell 169.254.22.1, length 28
19:35:23.637753 ARP, Request who-has 192.168.42.129 tell 169.254.22.1, length 28
19:35:26.604473 ARP, Request who-has 192.168.42.129 tell 169.254.22.1, length 28
19:35:27.611088 ARP, Request who-has 192.168.42.129 tell 169.254.22.1, length 28
19:35:28.624420 ARP, Request who-has 192.168.42.129 tell 169.254.22.1, length 28
19:35:31.140224 LLDP, length 104: (none).(none)
19:35:31.611230 ARP, Request who-has 192.168.42.129 tell 169.254.22.1, length 28
19:35:32.624419 ARP, Request who-has 192.168.42.129 tell 169.254.22.1, length 28
19:35:33.637754 ARP, Request who-has 192.168.42.129 tell 169.254.22.1, length 28
19:35:36.617806 ARP, Request who-has 192.168.42.129 tell 169.254.22.1, length 28
19:35:37.637751 ARP, Request who-has 192.168.42.129 tell 169.254.22.1, length 28
19:35:38.651089 ARP, Request who-has 192.168.42.129 tell 169.254.22.1, length 28
19:36:02.140159 LLDP, length 104: (none).(none)
19:36:21.227821 IP 0.0.0.0.bootpc > 255.255.255.255.bootps: BOOTP/DHCP, Request from 3c:97:0e:d8:80:6c (oui Unknown), length 350
19:36:33.140553 LLDP, length 104: (none).(none)
19:37:04.140523 LLDP, length 104: (none).(none)
19:37:24.454486 IP 0.0.0.0.bootpc > 255.255.255.255.bootps: BOOTP/DHCP, Request from 3c:97:0e:d8:80:6c (oui Unknown), length 350
19:37:35.140914 LLDP, length 104: (none).(none)
19:38:06.140866 LLDP, length 104: (none).(none)
19:38:29.504475 IP 0.0.0.0.bootpc > 255.255.255.255.bootps: BOOTP/DHCP, Request from 3c:97:0e:d8:80:6c (oui Unknown), length 350
19:38:37.141272 LLDP, length 104: (none).(none)
19:39:08.141156 LLDP, length 104: (none).(none)
19:39:33.527803 IP 0.0.0.0.bootpc > 255.255.255.255.bootps: BOOTP/DHCP, Request from 3c:97:0e:d8:80:6c (oui Unknown), length 350
19:39:39.141614 LLDP, length 104: (none).(none)
19:40:01.634296 ARP, Request who-has 192.168.42.129 tell 169.254.22.1, length 28
19:40:02.651059 ARP, Request who-has 192.168.42.129 tell 169.254.22.1, length 28
19:40:03.664392 ARP, Request who-has 192.168.42.129 tell 169.254.22.1, length 28
19:40:06.641111 ARP, Request who-has 192.168.42.129 tell 169.254.22.1, length 28
19:40:07.664392 ARP, Request who-has 192.168.42.129 tell 169.254.22.1, length 28
19:40:08.677726 ARP, Request who-has 192.168.42.129 tell 169.254.22.1, length 28
19:40:10.141544 LLDP, length 104: (none).(none)
19:40:11.647867 ARP, Request who-has 192.168.42.129 tell 169.254.22.1, length 28
19:40:12.651059 ARP, Request who-has 192.168.42.129 tell 169.254.22.1, length 28
19:40:13.664390 ARP, Request who-has 192.168.42.129 tell 169.254.22.1, length 28
19:40:16.654441 ARP, Request who-has 192.168.42.129 tell 169.254.22.1, length 28
19:40:17.664391 ARP, Request who-has 192.168.42.129 tell 169.254.22.1, length 28
19:40:18.677726 ARP, Request who-has 192.168.42.129 tell 169.254.22.1, length 28
19:40:21.915353 ARP, Request who-has 192.168.42.129 tell 169.254.22.1, length 28
19:40:22.917723 ARP, Request who-has 192.168.42.129 tell 169.254.22.1, length 28
19:40:23.931058 ARP, Request who-has 192.168.42.129 tell 169.254.22.1, length 28
19:40:26.921131 ARP, Request who-has 192.168.42.129 tell 169.254.22.1, length 28
19:40:27.931056 ARP, Request who-has 192.168.42.129 tell 169.254.22.1, length 28
19:40:28.944390 ARP, Request who-has 192.168.42.129 tell 169.254.22.1, length 28
19:40:31.927863 ARP, Request who-has 192.168.42.129 tell 169.254.22.1, length 28
19:40:32.944390 ARP, Request who-has 192.168.42.129 tell 169.254.22.1, length 28
19:40:33.957723 ARP, Request who-has 192.168.42.129 tell 169.254.22.1, length 28
19:40:36.934464 ARP, Request who-has 192.168.42.129 tell 169.254.22.1, length 28
19:40:37.957722 ARP, Request who-has 192.168.42.129 tell 169.254.22.1, length 28
19:40:38.347795 IP 0.0.0.0.bootpc > 255.255.255.255.bootps: BOOTP/DHCP, Request from 3c:97:0e:d8:80:6c (oui Unknown), length 350
19:40:38.971055 ARP, Request who-has 192.168.42.129 tell 169.254.22.1, length 28
19:40:41.141973 LLDP, length 104: (none).(none)
19:41:12.142565 LLDP, length 104: (none).(none)
19:41:41.901124 IP 0.0.0.0.bootpc > 255.255.255.255.bootps: BOOTP/DHCP, Request from 3c:97:0e:d8:80:6c (oui Unknown), length 350
19:41:43.142320 LLDP, length 104: (none).(none)
19:42:12.171629 IP 192.168.1.10.nfs > 239.255.255.250.1900: UDP, length 309
19:42:12.279914 IP 192.168.1.10.nfs > 239.255.255.250.1900: UDP, length 309
19:42:12.389862 IP 192.168.1.10.nfs > 239.255.255.250.1900: UDP, length 309
19:42:12.499860 IP 192.168.1.10.nfs > 239.255.255.250.1900: UDP, length 309
19:42:12.609884 IP 192.168.1.10.nfs > 239.255.255.250.1900: UDP, length 359
19:42:12.719863 IP 192.168.1.10.nfs > 239.255.255.250.1900: UDP, length 359
19:42:14.142259 LLDP, length 104: (none).(none)
19:42:45.142680 LLDP, length 104: (none).(none)
19:42:45.837782 IP 0.0.0.0.bootpc > 255.255.255.255.bootps: BOOTP/DHCP, Request from 3c:97:0e:d8:80:6c (oui Unknown), length 350
19:43:16.142625 LLDP, length 104: (none).(none)
19:43:47.143070 LLDP, length 104: (none).(none)
19:43:49.324441 IP 0.0.0.0.bootpc > 255.255.255.255.bootps: BOOTP/DHCP, Request from 3c:97:0e:d8:80:6c (oui Unknown), length 350
19:44:18.142992 LLDP, length 104: (none).(none)
19:44:49.143413 LLDP, length 104: (none).(none)
19:44:53.984441 IP 0.0.0.0.bootpc > 255.255.255.255.bootps: BOOTP/DHCP, Request from 3c:97:0e:d8:80:6c (oui Unknown), length 350
19:45:01.951253 ARP, Request who-has 192.168.42.129 tell 169.254.22.1, length 28
19:45:02.971031 ARP, Request who-has 192.168.42.129 tell 169.254.22.1, length 28
19:45:03.984363 ARP, Request who-has 192.168.42.129 tell 169.254.22.1, length 28
19:45:06.957740 ARP, Request who-has 192.168.42.129 tell 169.254.22.1, length 28
19:45:07.984365 ARP, Request who-has 192.168.42.129 tell 169.254.22.1, length 28
19:45:08.997694 ARP, Request who-has 192.168.42.129 tell 169.254.22.1, length 28
19:45:11.964505 ARP, Request who-has 192.168.42.129 tell 169.254.22.1, length 28
19:45:12.971029 ARP, Request who-has 192.168.42.129 tell 169.254.22.1, length 28
19:45:13.984360 ARP, Request who-has 192.168.42.129 tell 169.254.22.1, length 28
19:45:16.971070 ARP, Request who-has 192.168.42.129 tell 169.254.22.1, length 28
19:45:17.984360 ARP, Request who-has 192.168.42.129 tell 169.254.22.1, length 28
19:45:18.997693 ARP, Request who-has 192.168.42.129 tell 169.254.22.1, length 28
19:45:20.143351 LLDP, length 104: (none).(none)
19:45:22.228150 ARP, Request who-has 192.168.42.129 tell 169.254.22.1, length 28
19:45:23.237694 ARP, Request who-has 192.168.42.129 tell 169.254.22.1, length 28
19:45:24.251027 ARP, Request who-has 192.168.42.129 tell 169.254.22.1, length 28
19:45:27.234404 ARP, Request who-has 192.168.42.129 tell 169.254.22.1, length 28
19:45:28.251015 ARP, Request who-has 192.168.42.129 tell 169.254.22.1, length 28
19:45:29.264361 ARP, Request who-has 192.168.42.129 tell 169.254.22.1, length 28
19:45:32.241168 ARP, Request who-has 192.168.42.129 tell 169.254.22.1, length 28
19:45:33.264360 ARP, Request who-has 192.168.42.129 tell 169.254.22.1, length 28
19:45:34.277692 ARP, Request who-has 192.168.42.129 tell 169.254.22.1, length 28
19:45:37.247740 ARP, Request who-has 192.168.42.129 tell 169.254.22.1, length 28
19:45:38.251024 ARP, Request who-has 192.168.42.129 tell 169.254.22.1, length 28
19:45:39.264357 ARP, Request who-has 192.168.42.129 tell 169.254.22.1, length 28
19:45:51.143807 LLDP, length 104: (none).(none)
19:45:57.707765 IP 0.0.0.0.bootpc > 255.255.255.255.bootps: BOOTP/DHCP, Request from 3c:97:0e:d8:80:6c (oui Unknown), length 350
19:46:22.143711 LLDP, length 104: (none).(none)
19:46:53.144168 LLDP, length 104: (none).(none)
19:47:01.651091 IP 0.0.0.0.bootpc > 255.255.255.255.bootps: BOOTP/DHCP, Request from 3c:97:0e:d8:80:6c (oui Unknown), length 350
19:47:24.144110 LLDP, length 104: (none).(none)
19:47:55.144524 LLDP, length 104: (none).(none)
19:48:04.944415 IP 0.0.0.0.bootpc > 255.255.255.255.bootps: BOOTP/DHCP, Request from 3c:97:0e:d8:80:6c (oui Unknown), length 350
19:48:26.144480 LLDP, length 104: (none).(none)
19:48:57.144996 LLDP, length 104: (none).(none)
19:49:09.451077 IP 0.0.0.0.bootpc > 255.255.255.255.bootps: BOOTP/DHCP, Request from 3c:97:0e:d8:80:6c (oui Unknown), length 350
19:49:28.143191 LLDP, length 104: (none).(none)
19:49:59.143592 LLDP, length 104: (none).(none)
19:50:01.264499 ARP, Request who-has 192.168.42.129 tell 169.254.22.1, length 28
19:50:02.277668 ARP, Request who-has 192.168.42.129 tell 169.254.22.1, length 28
19:50:03.291000 ARP, Request who-has 192.168.42.129 tell 169.254.22.1, length 28
19:50:06.271050 ARP, Request who-has 192.168.42.129 tell 169.254.22.1, length 28
19:50:07.290999 ARP, Request who-has 192.168.42.129 tell 169.254.22.1, length 28
19:50:08.304334 ARP, Request who-has 192.168.42.129 tell 169.254.22.1, length 28
19:50:11.277805 ARP, Request who-has 192.168.42.129 tell 169.254.22.1, length 28
19:50:12.304335 ARP, Request who-has 192.168.42.129 tell 169.254.22.1, length 28
19:50:13.317662 ARP, Request who-has 192.168.42.129 tell 169.254.22.1, length 28
19:50:14.201075 IP 0.0.0.0.bootpc > 255.255.255.255.bootps: BOOTP/DHCP, Request from 3c:97:0e:d8:80:6c (oui Unknown), length 350
19:50:16.284384 ARP, Request who-has 192.168.42.129 tell 169.254.22.1, length 28
19:50:17.290999 ARP, Request who-has 192.168.42.129 tell 169.254.22.1, length 28
19:50:18.304333 ARP, Request who-has 192.168.42.129 tell 169.254.22.1, length 28
19:50:21.541302 ARP, Request who-has 192.168.42.129 tell 169.254.22.1, length 28
19:50:22.544335 ARP, Request who-has 192.168.42.129 tell 169.254.22.1, length 28
19:50:23.557664 ARP, Request who-has 192.168.42.129 tell 169.254.22.1, length 28
19:50:26.547716 ARP, Request who-has 192.168.42.129 tell 169.254.22.1, length 28
19:50:27.557663 ARP, Request who-has 192.168.42.129 tell 169.254.22.1, length 28
19:50:28.570996 ARP, Request who-has 192.168.42.129 tell 169.254.22.1, length 28
19:50:30.143517 LLDP, length 104: (none).(none)
19:50:31.554473 ARP, Request who-has 192.168.42.129 tell 169.254.22.1, length 28
19:50:32.570997 ARP, Request who-has 192.168.42.129 tell 169.254.22.1, length 28
19:50:33.584329 ARP, Request who-has 192.168.42.129 tell 169.254.22.1, length 28
19:50:36.561050 ARP, Request who-has 192.168.42.129 tell 169.254.22.1, length 28
19:50:37.584329 ARP, Request who-has 192.168.42.129 tell 169.254.22.1, length 28
19:50:38.597661 ARP, Request who-has 192.168.42.129 tell 169.254.22.1, length 28
19:51:01.143980 LLDP, length 104: (none).(none)
19:51:17.251049 IP 0.0.0.0.bootpc > 255.255.255.255.bootps: BOOTP/DHCP, Request from 3c:97:0e:d8:80:6c (oui Unknown), length 350
19:51:32.143919 LLDP, length 104: (none).(none)
19:52:03.144344 LLDP, length 104: (none).(none)
19:52:21.717724 IP 0.0.0.0.bootpc > 255.255.255.255.bootps: BOOTP/DHCP, Request from 3c:97:0e:d8:80:6c (oui Unknown), length 350
19:52:34.144311 LLDP, length 104: (none).(none)
19:53:05.144884 LLDP, length 104: (none).(none)
19:53:24.987720 IP 0.0.0.0.bootpc > 255.255.255.255.bootps: BOOTP/DHCP, Request from 3c:97:0e:d8:80:6c (oui Unknown), length 350
19:53:36.144701 LLDP, length 104: (none).(none)
19:54:07.145630 LLDP, length 104: (none).(none)
19:54:28.184378 IP 0.0.0.0.bootpc > 255.255.255.255.bootps: BOOTP/DHCP, Request from 3c:97:0e:d8:80:6c (oui Unknown), length 350
19:54:38.145142 LLDP, length 104: (none).(none)
19:55:01.577773 ARP, Request who-has 192.168.42.129 tell 169.254.22.1, length 28
19:55:02.597638 ARP, Request who-has 192.168.42.129 tell 169.254.22.1, length 28
19:55:03.610969 ARP, Request who-has 192.168.42.129 tell 169.254.22.1, length 28
19:55:06.584354 ARP, Request who-has 192.168.42.129 tell 169.254.22.1, length 28
19:55:07.610970 ARP, Request who-has 192.168.42.129 tell 169.254.22.1, length 28
19:55:08.624304 ARP, Request who-has 192.168.42.129 tell 169.254.22.1, length 28
19:55:09.145603 LLDP, length 104: (none).(none)
19:55:11.591113 ARP, Request who-has 192.168.42.129 tell 169.254.22.1, length 28
19:55:12.597638 ARP, Request who-has 192.168.42.129 tell 169.254.22.1, length 28
19:55:13.610971 ARP, Request who-has 192.168.42.129 tell 169.254.22.1, length 28
19:55:16.597687 ARP, Request who-has 192.168.42.129 tell 169.254.22.1, length 28
19:55:17.610970 ARP, Request who-has 192.168.42.129 tell 169.254.22.1, length 28
19:55:18.624303 ARP, Request who-has 192.168.42.129 tell 169.254.22.1, length 28
19:55:21.860702 ARP, Request who-has 192.168.42.129 tell 169.254.22.1, length 28
19:55:22.864304 ARP, Request who-has 192.168.42.129 tell 169.254.22.1, length 28
19:55:23.877637 ARP, Request who-has 192.168.42.129 tell 169.254.22.1, length 28
19:55:26.867681 ARP, Request who-has 192.168.42.129 tell 169.254.22.1, length 28
19:55:27.877638 ARP, Request who-has 192.168.42.129 tell 169.254.22.1, length 28
19:55:28.890967 ARP, Request who-has 192.168.42.129 tell 169.254.22.1, length 28
19:55:31.874445 ARP, Request who-has 192.168.42.129 tell 169.254.22.1, length 28
19:55:31.917690 IP 0.0.0.0.bootpc > 255.255.255.255.bootps: BOOTP/DHCP, Request from 3c:97:0e:d8:80:6c (oui Unknown), length 350
19:55:32.890968 ARP, Request who-has 192.168.42.129 tell 169.254.22.1, length 28
19:55:33.904300 ARP, Request who-has 192.168.42.129 tell 169.254.22.1, length 28
19:55:36.881015 ARP, Request who-has 192.168.42.129 tell 169.254.22.1, length 28
19:55:37.904299 ARP, Request who-has 192.168.42.129 tell 169.254.22.1, length 28
19:55:38.917633 ARP, Request who-has 192.168.42.129 tell 169.254.22.1, length 28
19:55:40.145538 LLDP, length 104: (none).(none)
19:56:11.146024 LLDP, length 104: (none).(none)
19:56:35.884354 IP 0.0.0.0.bootpc > 255.255.255.255.bootps: BOOTP/DHCP, Request from 3c:97:0e:d8:80:6c (oui Unknown), length 350
19:56:42.145933 LLDP, length 104: (none).(none)
19:56:42.517062 IP 192.168.1.10.nfs > 239.255.255.250.1900: UDP, length 309
19:56:42.625301 IP 192.168.1.10.nfs > 239.255.255.250.1900: UDP, length 309
19:56:42.735314 IP 192.168.1.10.nfs > 239.255.255.250.1900: UDP, length 309
19:56:42.845289 IP 192.168.1.10.nfs > 239.255.255.250.1900: UDP, length 309
19:56:42.955343 IP 192.168.1.10.nfs > 239.255.255.250.1900: UDP, length 359
19:56:43.065383 IP 192.168.1.10.nfs > 239.255.255.250.1900: UDP, length 359
19:57:13.146460 LLDP, length 104: (none).(none)
19:57:39.244359 IP 0.0.0.0.bootpc > 255.255.255.255.bootps: BOOTP/DHCP, Request from 3c:97:0e:d8:80:6c (oui Unknown), length 350
19:57:44.146383 LLDP, length 104: (none).(none)
19:58:15.146868 LLDP, length 104: (none).(none)
19:58:43.047678 IP 0.0.0.0.bootpc > 255.255.255.255.bootps: BOOTP/DHCP, Request from 3c:97:0e:d8:80:6c (oui Unknown), length 350
19:58:46.146817 LLDP, length 104: (none).(none)
19:59:17.147296 LLDP, length 104: (none).(none)
19:59:47.577679 IP 0.0.0.0.bootpc > 255.255.255.255.bootps: BOOTP/DHCP, Request from 3c:97:0e:d8:80:6c (oui Unknown), length 350
19:59:48.147249 LLDP, length 104: (none).(none)
20:00:01.897547 ARP, Request who-has 192.168.42.129 tell 169.254.22.1, length 28
20:00:02.917606 ARP, Request who-has 192.168.42.129 tell 169.254.22.1, length 28
20:00:03.930940 ARP, Request who-has 192.168.42.129 tell 169.254.22.1, length 28
20:00:06.904328 ARP, Request who-has 192.168.42.129 tell 169.254.22.1, length 28
20:00:07.930940 ARP, Request who-has 192.168.42.129 tell 169.254.22.1, length 28
20:00:08.944274 ARP, Request who-has 192.168.42.129 tell 169.254.22.1, length 28
20:00:11.911081 ARP, Request who-has 192.168.42.129 tell 169.254.22.1, length 28
20:00:12.917604 ARP, Request who-has 192.168.42.129 tell 169.254.22.1, length 28
20:00:13.930940 ARP, Request who-has 192.168.42.129 tell 169.254.22.1, length 28
20:00:16.917653 ARP, Request who-has 192.168.42.129 tell 169.254.22.1, length 28
20:00:17.930939 ARP, Request who-has 192.168.42.129 tell 169.254.22.1, length 28
20:00:18.944273 ARP, Request who-has 192.168.42.129 tell 169.254.22.1, length 28
20:00:19.148338 LLDP, length 104: (none).(none)
20:00:22.179168 ARP, Request who-has 192.168.42.129 tell 169.254.22.1, length 28
20:00:23.184267 ARP, Request who-has 192.168.42.129 tell 169.254.22.1, length 28
20:00:24.197605 ARP, Request who-has 192.168.42.129 tell 169.254.22.1, length 28
20:00:27.184323 ARP, Request who-has 192.168.42.129 tell 169.254.22.1, length 28
20:00:28.197604 ARP, Request who-has 192.168.42.129 tell 169.254.22.1, length 28
20:00:29.210937 ARP, Request who-has 192.168.42.129 tell 169.254.22.1, length 28
20:00:32.191078 ARP, Request who-has 192.168.42.129 tell 169.254.22.1, length 28
20:00:33.210937 ARP, Request who-has 192.168.42.129 tell 169.254.22.1, length 28
20:00:34.224269 ARP, Request who-has 192.168.42.129 tell 169.254.22.1, length 28
20:00:37.197655 ARP, Request who-has 192.168.42.129 tell 169.254.22.1, length 28
20:00:38.224270 ARP, Request who-has 192.168.42.129 tell 169.254.22.1, length 28
20:00:39.237603 ARP, Request who-has 192.168.42.129 tell 169.254.22.1, length 28
20:00:50.147667 LLDP, length 104: (none).(none)
20:00:50.767675 IP 0.0.0.0.bootpc > 255.255.255.255.bootps: BOOTP/DHCP, Request from 3c:97:0e:d8:80:6c (oui Unknown), length 350
20:01:21.148147 LLDP, length 104: (none).(none)
20:01:52.148102 LLDP, length 104: (none).(none)
20:01:55.001003 IP 0.0.0.0.bootpc > 255.255.255.255.bootps: BOOTP/DHCP, Request from 3c:97:0e:d8:80:6c (oui Unknown), length 350
20:02:23.148544 LLDP, length 104: (none).(none)
20:02:54.148514 LLDP, length 104: (none).(none)
20:02:58.507660 IP 0.0.0.0.bootpc > 255.255.255.255.bootps: BOOTP/DHCP, Request from 3c:97:0e:d8:80:6c (oui Unknown), length 350
20:03:25.149004 LLDP, length 104: (none).(none)
20:03:56.148926 LLDP, length 104: (none).(none)
20:04:02.684321 IP 0.0.0.0.bootpc > 255.255.255.255.bootps: BOOTP/DHCP, Request from 3c:97:0e:d8:80:6c (oui Unknown), length 350
20:04:27.149407 LLDP, length 104: (none).(none)
20:04:58.149377 LLDP, length 104: (none).(none)
20:05:01.214487 ARP, Request who-has 192.168.42.129 tell 169.254.22.1, length 28
20:05:02.224243 ARP, Request who-has 192.168.42.129 tell 169.254.22.1, length 28
20:05:03.237578 ARP, Request who-has 192.168.42.129 tell 169.254.22.1, length 28
20:05:06.220961 ARP, Request who-has 192.168.42.129 tell 169.254.22.1, length 28
20:05:07.237576 ARP, Request who-has 192.168.42.129 tell 169.254.22.1, length 28
20:05:07.397648 IP 0.0.0.0.bootpc > 255.255.255.255.bootps: BOOTP/DHCP, Request from 3c:97:0e:d8:80:6c (oui Unknown), length 350
20:05:08.250907 ARP, Request who-has 192.168.42.129 tell 169.254.22.1, length 28
20:05:11.227725 ARP, Request who-has 192.168.42.129 tell 169.254.22.1, length 28
20:05:12.250909 ARP, Request who-has 192.168.42.129 tell 169.254.22.1, length 28
20:05:13.264241 ARP, Request who-has 192.168.42.129 tell 169.254.22.1, length 28
20:05:16.234296 ARP, Request who-has 192.168.42.129 tell 169.254.22.1, length 28
20:05:17.237574 ARP, Request who-has 192.168.42.129 tell 169.254.22.1, length 28
20:05:18.250909 ARP, Request who-has 192.168.42.129 tell 169.254.22.1, length 28
20:05:21.491250 ARP, Request who-has 192.168.42.129 tell 169.254.22.1, length 28
20:05:22.517585 ARP, Request who-has 192.168.42.129 tell 169.254.22.1, length 28
20:05:23.530904 ARP, Request who-has 192.168.42.129 tell 169.254.22.1, length 28
20:05:26.497624 ARP, Request who-has 192.168.42.129 tell 169.254.22.1, length 28
20:05:27.504237 ARP, Request who-has 192.168.42.129 tell 169.254.22.1, length 28
20:05:28.517573 ARP, Request who-has 192.168.42.129 tell 169.254.22.1, length 28
20:05:29.149823 LLDP, length 104: (none).(none)
20:05:31.504385 ARP, Request who-has 192.168.42.129 tell 169.254.22.1, length 28
20:05:32.517574 ARP, Request who-has 192.168.42.129 tell 169.254.22.1, length 28
20:05:33.530904 ARP, Request who-has 192.168.42.129 tell 169.254.22.1, length 28
20:05:36.510954 ARP, Request who-has 192.168.42.129 tell 169.254.22.1, length 28
20:05:37.530905 ARP, Request who-has 192.168.42.129 tell 169.254.22.1, length 28
20:05:38.544249 ARP, Request who-has 192.168.42.129 tell 169.254.22.1, length 28
20:06:00.149794 LLDP, length 104: (none).(none)
20:06:11.494296 IP 0.0.0.0.bootpc > 255.255.255.255.bootps: BOOTP/DHCP, Request from 3c:97:0e:d8:80:6c (oui Unknown), length 350
20:06:31.150282 LLDP, length 104: (none).(none)
20:07:02.150210 LLDP, length 104: (none).(none)
20:07:15.380955 IP 0.0.0.0.bootpc > 255.255.255.255.bootps: BOOTP/DHCP, Request from 3c:97:0e:d8:80:6c (oui Unknown), length 350
20:07:33.150658 LLDP, length 104: (none).(none)
20:08:04.150614 LLDP, length 104: (none).(none)
20:08:19.007617 IP 0.0.0.0.bootpc > 255.255.255.255.bootps: BOOTP/DHCP, Request from 3c:97:0e:d8:80:6c (oui Unknown), length 350
20:08:35.151071 LLDP, length 104: (none).(none)
20:09:06.151017 LLDP, length 104: (none).(none)
20:09:22.727621 IP 0.0.0.0.bootpc > 255.255.255.255.bootps: BOOTP/DHCP, Request from 3c:97:0e:d8:80:6c (oui Unknown), length 350
20:09:37.151509 LLDP, length 104: (none).(none)
20:10:01.527714 ARP, Request who-has 192.168.42.129 tell 169.254.22.1, length 28
20:10:02.544215 ARP, Request who-has 192.168.42.129 tell 169.254.22.1, length 28
20:10:03.557545 ARP, Request who-has 192.168.42.129 tell 169.254.22.1, length 28
20:10:06.534265 ARP, Request who-has 192.168.42.129 tell 169.254.22.1, length 28
20:10:07.557546 ARP, Request who-has 192.168.42.129 tell 169.254.22.1, length 28
20:10:08.151461 LLDP, length 104: (none).(none)
20:10:08.570877 ARP, Request who-has 192.168.42.129 tell 169.254.22.1, length 28
20:10:11.541020 ARP, Request who-has 192.168.42.129 tell 169.254.22.1, length 28
20:10:12.544211 ARP, Request who-has 192.168.42.129 tell 169.254.22.1, length 28
20:10:13.557546 ARP, Request who-has 192.168.42.129 tell 169.254.22.1, length 28
20:10:16.547597 ARP, Request who-has 192.168.42.129 tell 169.254.22.1, length 28
20:10:17.557544 ARP, Request who-has 192.168.42.129 tell 169.254.22.1, length 28
20:10:18.570878 ARP, Request who-has 192.168.42.129 tell 169.254.22.1, length 28
20:10:21.806656 ARP, Request who-has 192.168.42.129 tell 169.254.22.1, length 28
20:10:22.810877 ARP, Request who-has 192.168.42.129 tell 169.254.22.1, length 28
20:10:23.824213 ARP, Request who-has 192.168.42.129 tell 169.254.22.1, length 28
20:10:26.814260 ARP, Request who-has 192.168.42.129 tell 169.254.22.1, length 28
20:10:26.817600 IP 0.0.0.0.bootpc > 255.255.255.255.bootps: BOOTP/DHCP, Request from 3c:97:0e:d8:80:6c (oui Unknown), length 350
20:10:27.824210 ARP, Request who-has 192.168.42.129 tell 169.254.22.1, length 28
20:10:28.837546 ARP, Request who-has 192.168.42.129 tell 169.254.22.1, length 28
20:10:31.821019 ARP, Request who-has 192.168.42.129 tell 169.254.22.1, length 28
20:10:32.837544 ARP, Request who-has 192.168.42.129 tell 169.254.22.1, length 28
20:10:33.850879 ARP, Request who-has 192.168.42.129 tell 169.254.22.1, length 28
20:10:36.827593 ARP, Request who-has 192.168.42.129 tell 169.254.22.1, length 28
20:10:37.850878 ARP, Request who-has 192.168.42.129 tell 169.254.22.1, length 28
20:10:38.864213 ARP, Request who-has 192.168.42.129 tell 169.254.22.1, length 28
20:10:39.151916 LLDP, length 104: (none).(none)
20:11:10.151871 LLDP, length 104: (none).(none)
20:11:12.522962 IP 192.168.1.10.nfs > 239.255.255.250.1900: UDP, length 309
20:11:12.631209 IP 192.168.1.10.nfs > 239.255.255.250.1900: UDP, length 309
20:11:12.741202 IP 192.168.1.10.nfs > 239.255.255.250.1900: UDP, length 309
20:11:12.851201 IP 192.168.1.10.nfs > 239.255.255.250.1900: UDP, length 309
20:11:12.961246 IP 192.168.1.10.nfs > 239.255.255.250.1900: UDP, length 359
20:11:13.071270 IP 192.168.1.10.nfs > 239.255.255.250.1900: UDP, length 359
20:11:30.334265 IP 0.0.0.0.bootpc > 255.255.255.255.bootps: BOOTP/DHCP, Request from 3c:97:0e:d8:80:6c (oui Unknown), length 350
20:11:41.152357 LLDP, length 104: (none).(none)
20:12:12.152296 LLDP, length 104: (none).(none)
20:12:35.184257 IP 0.0.0.0.bootpc > 255.255.255.255.bootps: BOOTP/DHCP, Request from 3c:97:0e:d8:80:6c (oui Unknown), length 350
20:12:43.152776 LLDP, length 104: (none).(none)
20:13:14.152712 LLDP, length 104: (none).(none)
20:13:38.484265 IP 0.0.0.0.bootpc > 255.255.255.255.bootps: BOOTP/DHCP, Request from 3c:97:0e:d8:80:6c (oui Unknown), length 350
20:13:45.153176 LLDP, length 104: (none).(none)
20:14:16.153112 LLDP, length 104: (none).(none)
20:14:43.204261 IP 0.0.0.0.bootpc > 255.255.255.255.bootps: BOOTP/DHCP, Request from 3c:97:0e:d8:80:6c (oui Unknown), length 350
20:14:47.153582 LLDP, length 104: (none).(none)
20:15:01.841058 ARP, Request who-has 192.168.42.129 tell 169.254.22.1, length 28
20:15:02.864183 ARP, Request who-has 192.168.42.129 tell 169.254.22.1, length 28
20:15:03.877517 ARP, Request who-has 192.168.42.129 tell 169.254.22.1, length 28
20:15:06.847566 ARP, Request who-has 192.168.42.129 tell 169.254.22.1, length 28
20:15:07.850851 ARP, Request who-has 192.168.42.129 tell 169.254.22.1, length 28
20:15:08.864183 ARP, Request who-has 192.168.42.129 tell 169.254.22.1, length 28
20:15:11.854327 ARP, Request who-has 192.168.42.129 tell 169.254.22.1, length 28
20:15:12.864182 ARP, Request who-has 192.168.42.129 tell 169.254.22.1, length 28
20:15:13.877515 ARP, Request who-has 192.168.42.129 tell 169.254.22.1, length 28
20:15:16.860897 ARP, Request who-has 192.168.42.129 tell 169.254.22.1, length 28
20:15:17.877516 ARP, Request who-has 192.168.42.129 tell 169.254.22.1, length 28
20:15:18.153504 LLDP, length 104: (none).(none)
20:15:18.890849 ARP, Request who-has 192.168.42.129 tell 169.254.22.1, length 28
20:15:22.115144 ARP, Request who-has 192.168.42.129 tell 169.254.22.1, length 28
20:15:23.130847 ARP, Request who-has 192.168.42.129 tell 169.254.22.1, length 28
20:15:24.144181 ARP, Request who-has 192.168.42.129 tell 169.254.22.1, length 28
20:15:27.120900 ARP, Request who-has 192.168.42.129 tell 169.254.22.1, length 28
20:15:28.144160 ARP, Request who-has 192.168.42.129 tell 169.254.22.1, length 28
20:15:29.157516 ARP, Request who-has 192.168.42.129 tell 169.254.22.1, length 28
20:15:32.127649 ARP, Request who-has 192.168.42.129 tell 169.254.22.1, length 28
20:15:33.130846 ARP, Request who-has 192.168.42.129 tell 169.254.22.1, length 28
20:15:34.144180 ARP, Request who-has 192.168.42.129 tell 169.254.22.1, length 28
20:15:37.134226 ARP, Request who-has 192.168.42.129 tell 169.254.22.1, length 28
20:15:38.144178 ARP, Request who-has 192.168.42.129 tell 169.254.22.1, length 28
20:15:39.157511 ARP, Request who-has 192.168.42.129 tell 169.254.22.1, length 28
20:15:47.840910 IP 0.0.0.0.bootpc > 255.255.255.255.bootps: BOOTP/DHCP, Request from 3c:97:0e:d8:80:6c (oui Unknown), length 350
20:15:49.154016 LLDP, length 104: (none).(none)
20:16:20.153915 LLDP, length 104: (none).(none)
20:16:51.154430 LLDP, length 104: (none).(none)
20:16:52.184234 IP 0.0.0.0.bootpc > 255.255.255.255.bootps: BOOTP/DHCP, Request from 3c:97:0e:d8:80:6c (oui Unknown), length 350
20:17:22.154360 LLDP, length 104: (none).(none)
20:17:53.154818 LLDP, length 104: (none).(none)
20:17:55.960905 IP 0.0.0.0.bootpc > 255.255.255.255.bootps: BOOTP/DHCP, Request from 3c:97:0e:d8:80:6c (oui Unknown), length 350
20:18:24.154764 LLDP, length 104: (none).(none)
20:18:55.155271 LLDP, length 104: (none).(none)
20:19:00.360890 IP 0.0.0.0.bootpc > 255.255.255.255.bootps: BOOTP/DHCP, Request from 3c:97:0e:d8:80:6c (oui Unknown), length 350
20:19:26.155256 LLDP, length 104: (none).(none)
20:19:57.155659 LLDP, length 104: (none).(none)
20:20:01.150995 ARP, Request who-has 192.168.42.129 tell 169.254.22.1, length 28
20:20:02.170821 ARP, Request who-has 192.168.42.129 tell 169.254.22.1, length 28
20:20:03.184152 ARP, Request who-has 192.168.42.129 tell 169.254.22.1, length 28
20:20:04.920895 IP 0.0.0.0.bootpc > 255.255.255.255.bootps: BOOTP/DHCP, Request from 3c:97:0e:d8:80:6c (oui Unknown), length 350
20:20:06.157538 ARP, Request who-has 192.168.42.129 tell 169.254.22.1, length 28
20:20:07.184152 ARP, Request who-has 192.168.42.129 tell 169.254.22.1, length 28
20:20:08.197486 ARP, Request who-has 192.168.42.129 tell 169.254.22.1, length 28
20:20:11.164301 ARP, Request who-has 192.168.42.129 tell 169.254.22.1, length 28
20:20:12.170820 ARP, Request who-has 192.168.42.129 tell 169.254.22.1, length 28
20:20:13.184152 ARP, Request who-has 192.168.42.129 tell 169.254.22.1, length 28
20:20:16.170872 ARP, Request who-has 192.168.42.129 tell 169.254.22.1, length 28
20:20:17.184152 ARP, Request who-has 192.168.42.129 tell 169.254.22.1, length 28
20:20:18.197486 ARP, Request who-has 192.168.42.129 tell 169.254.22.1, length 28
20:20:21.430227 ARP, Request who-has 192.168.42.129 tell 169.254.22.1, length 28
20:20:22.437485 ARP, Request who-has 192.168.42.129 tell 169.254.22.1, length 28
20:20:23.450818 ARP, Request who-has 192.168.42.129 tell 169.254.22.1, length 28
20:20:26.430893 ARP, Request who-has 192.168.42.129 tell 169.254.22.1, length 28
20:20:27.450818 ARP, Request who-has 192.168.42.129 tell 169.254.22.1, length 28
20:20:28.155574 LLDP, length 104: (none).(none)
20:20:28.464151 ARP, Request who-has 192.168.42.129 tell 169.254.22.1, length 28
20:20:31.437626 ARP, Request who-has 192.168.42.129 tell 169.254.22.1, length 28
20:20:32.464151 ARP, Request who-has 192.168.42.129 tell 169.254.22.1, length 28
20:20:33.477484 ARP, Request who-has 192.168.42.129 tell 169.254.22.1, length 28
20:20:36.444198 ARP, Request who-has 192.168.42.129 tell 169.254.22.1, length 28
20:20:37.450818 ARP, Request who-has 192.168.42.129 tell 169.254.22.1, length 28
20:20:38.464150 ARP, Request who-has 192.168.42.129 tell 169.254.22.1, length 28
20:20:59.156092 LLDP, length 104: (none).(none)
20:21:09.650872 IP 0.0.0.0.bootpc > 255.255.255.255.bootps: BOOTP/DHCP, Request from 3c:97:0e:d8:80:6c (oui Unknown), length 350
20:21:30.156025 LLDP, length 104: (none).(none)
20:22:01.156517 LLDP, length 104: (none).(none)
20:22:13.047533 IP 0.0.0.0.bootpc > 255.255.255.255.bootps: BOOTP/DHCP, Request from 3c:97:0e:d8:80:6c (oui Unknown), length 350
20:22:32.156431 LLDP, length 104: (none).(none)
20:23:03.156904 LLDP, length 104: (none).(none)
20:23:17.154194 IP 0.0.0.0.bootpc > 255.255.255.255.bootps: BOOTP/DHCP, Request from 3c:97:0e:d8:80:6c (oui Unknown), length 350
20:23:34.157006 LLDP, length 104: (none).(none)
20:24:05.157321 LLDP, length 104: (none).(none)
20:24:21.400854 IP 0.0.0.0.bootpc > 255.255.255.255.bootps: BOOTP/DHCP, Request from 3c:97:0e:d8:80:6c (oui Unknown), length 350
20:24:36.157566 LLDP, length 104: (none).(none)
20:25:01.467525 ARP, Request who-has 192.168.42.129 tell 169.254.22.1, length 28
20:25:02.490789 ARP, Request who-has 192.168.42.129 tell 169.254.22.1, length 28
20:25:03.504123 ARP, Request who-has 192.168.42.129 tell 169.254.22.1, length 28
20:25:06.474176 ARP, Request who-has 192.168.42.129 tell 169.254.22.1, length 28
20:25:07.157755 LLDP, length 104: (none).(none)
20:25:07.477456 ARP, Request who-has 192.168.42.129 tell 169.254.22.1, length 28
20:25:08.490791 ARP, Request who-has 192.168.42.129 tell 169.254.22.1, length 28
20:25:11.480933 ARP, Request who-has 192.168.42.129 tell 169.254.22.1, length 28
20:25:12.490788 ARP, Request who-has 192.168.42.129 tell 169.254.22.1, length 28
20:25:13.504121 ARP, Request who-has 192.168.42.129 tell 169.254.22.1, length 28
20:25:16.487511 ARP, Request who-has 192.168.42.129 tell 169.254.22.1, length 28
20:25:17.504122 ARP, Request who-has 192.168.42.129 tell 169.254.22.1, length 28
20:25:18.517454 ARP, Request who-has 192.168.42.129 tell 169.254.22.1, length 28
20:25:21.748400 ARP, Request who-has 192.168.42.129 tell 169.254.22.1, length 28
20:25:22.757454 ARP, Request who-has 192.168.42.129 tell 169.254.22.1, length 28
20:25:23.770788 ARP, Request who-has 192.168.42.129 tell 169.254.22.1, length 28
20:25:24.480863 IP 0.0.0.0.bootpc > 255.255.255.255.bootps: BOOTP/DHCP, Request from 3c:97:0e:d8:80:6c (oui Unknown), length 350
20:25:26.754199 ARP, Request who-has 192.168.42.129 tell 169.254.22.1, length 28
20:25:27.770786 ARP, Request who-has 192.168.42.129 tell 169.254.22.1, length 28
20:25:28.784122 ARP, Request who-has 192.168.42.129 tell 169.254.22.1, length 28
20:25:31.760933 ARP, Request who-has 192.168.42.129 tell 169.254.22.1, length 28
20:25:32.784122 ARP, Request who-has 192.168.42.129 tell 169.254.22.1, length 28
20:25:33.797453 ARP, Request who-has 192.168.42.129 tell 169.254.22.1, length 28
20:25:36.767503 ARP, Request who-has 192.168.42.129 tell 169.254.22.1, length 28
20:25:37.770785 ARP, Request who-has 192.168.42.129 tell 169.254.22.1, length 28
20:25:38.157684 LLDP, length 104: (none).(none)
20:25:38.784121 ARP, Request who-has 192.168.42.129 tell 169.254.22.1, length 28
20:25:42.531948 IP 192.168.1.10.nfs > 239.255.255.250.1900: UDP, length 309
20:25:42.637042 IP 192.168.1.10.nfs > 239.255.255.250.1900: UDP, length 309
20:25:42.747041 IP 192.168.1.10.nfs > 239.255.255.250.1900: UDP, length 309
20:25:42.857037 IP 192.168.1.10.nfs > 239.255.255.250.1900: UDP, length 309
20:25:42.967092 IP 192.168.1.10.nfs > 239.255.255.250.1900: UDP, length 359
20:25:43.077115 IP 192.168.1.10.nfs > 239.255.255.250.1900: UDP, length 359
